,title,author
466,"Little Fire (Warriors of the Five Realms, #1)",Hollee Mands
467,Chasing Love (Dark Love #1),Kat T. Masen
468,"Dear Love, I Hate You (Easton High, #1)",Eliah Greenwood
469,The Mountain Is You: Transforming Self-Sabotage Into Self-Mastery (Kindle Edition),Brianna Wiest
470,Instructions for Dancing (Kindle Edition),Nicola Yoon
471,"The Legacy (Off-Campus, #5)",Elle Kennedy
472,Second First Impressions (Hardcover),Sally Thorne
473,The Beekeeper of Aleppo (Hardcover),Christy Lefteri
474,Her Body and Other Parties: Stories (Paperback),Carmen Maria Machado
475,"The Play (Briar U, #3)",Elle Kennedy
476,Five Feet Apart (ebook),Rachael Lippincott
477,Eleanor & Park (Hardcover),Rainbow Rowell
478,How to Make Friends with the Dark (Hardcover),Kathleen Glasgow
479,"The Stopover (The Miles High Club, #1)",T.L. Swan
480,"Bad Habit (Bad Love, #1)",Charleigh Rose
481,Gone Girl (Paperback),Gillian Flynn
482,"A Game of Fate (Hades Saga, #1)",Scarlett St. Clair
483,"Graceling (Graceling Realm, #1)",Kristin Cashore
484,The Nightingale (Hardcover),Kristin Hannah
485,"The Hate U Give (The Hate U Give, #1)",Angie Thomas
486,"Illuminae (The Illuminae Files, #1)",Amie Kaufman
487,Foundryside (Kindle Edition),Robert Jackson Bennett
488,Tell Me Three Things (Hardcover),Julie Buxbaum
489,"Onyx and Ivory (Rime Chronicles, #1)",Mindee Arnett
490,"Lady Midnight (The Dark Artifices, #1)",Cassandra Clare
491,"Flame in the Mist (Flame in the Mist, #1)",Renée Ahdieh
492,Good Girl Complex (Paperback),Elle Kennedy
493,Every Last Secret (Kindle Edition),A.R. Torre
494,"The Wisteria Society of Lady Scoundrels (Dangerous Damsels, #1)",India Holton
495,Sugar Daddies (Paperback),Jade West
496,"An Heir Comes to Rise (An Heir Comes to Rise, #1)",C.C. Peñaranda
497,"Pawn (Fae Games, #1)",Karen Lynch
498,The Alchemist (Paperback),Paulo Coelho
499,"Collided (Dirty Air, #2)",Lauren Asher
500,"Stay with Me (Stay with Me, #1)",Nicole Fiorina
501,"Beautiful Bastard (Beautiful Bastard, #1)",Christina Lauren
502,The Problem with Forever (Hardcover),Jennifer L. Armentrout
503,Everything I Never Told You (Hardcover),Celeste Ng
504,The Southern Book Club's Guide to Slaying Vampires (Kindle Edition),Grady Hendrix
505,"The Crown (The Selection, #5)",Kiera Cass
506,"Champion (Legend, #3)",Marie Lu
507,"Black Sun (Between Earth and Sky, #1)",Rebecca Roanhorse
508,"Spoiler Alert (Spoiler Alert, #1)",Olivia Dade
509,"The Midnight Lie (Forgotten Gods, #1)",Marie Rutkoski
510,"Archenemies (Renegades, #2)",Marissa Meyer
511,Before We Were Strangers (Paperback),Renee Carlino
512,Felix Ever After (Hardcover),Kacen Callender
513,Perfect on Paper (Hardcover),Sophie Gonzales
514,"Juniper Hill (The Edens, #2)",Devney Perry
515,"This Woven Kingdom (This Woven Kingdom, #1)",Tahereh Mafi
516,Dating Dr. Dil (If Shakespeare was an Auntie #1),Nisha Sharma
517,By a Thread (Kindle Edition),Lucy Score
518,Heavenly Bodies (Heavenly Bodies #1),Imani Erriu
519,"Blood Crown (Freedom's Harem, #1)",Elizabeth Brown
520,"Aristotle and Dante Dive into the Waters of the World (Aristotle and Dante, #2)",Benjamin Alire Sáenz
521,The Lost Apothecary (Hardcover),Sarah Penner
522,Your Dad Will Do (A Touch of Taboo #1),Katee Robert
523,The Henna Wars (Hardcover),Adiba Jaigirdar
524,"The Bride Test (The Kiss Quotient, #2)",Helen Hoang
525,"Sea of Ruin (Sea of Ruin, #1)",Pam Godwin
526,Exciting Times (Hardcover),Naoise Dolan
527,"The Unspoken Name (The Serpent Gates, #1)",A.K. Larkwood
528,If He Had Been with Me (Paperback),Laura Nowlin
529,"Welcome to the Dark Side (The Fallen Men, #2)",Giana Darling
530,Orbiting Jupiter (Kindle Edition),Gary D. Schmidt
531,"The Duke and I (Bridgertons, #1)",Julia Quinn
532,House of Leaves (Paperback),Mark Z. Danielewski
533,The Dreamers (Hardcover),Karen Thompson Walker
534,"Truthwitch (The Witchlands, #1)",Susan Dennard
535,"Supernova (Renegades, #3)",Marissa Meyer
536,"And I Darken (The Conqueror's Saga, #1)",Kiersten White
537,"My Sister, the Serial Killer (Hardcover)",Oyinkan Braithwaite
538,"The Ballad of Songbirds and Snakes (The Hunger Games, #0)",Suzanne Collins
539,"A Dark and Hollow Star (The Hollow Star Saga, #1)",Ashley Shuttleworth
540,Sweet & Bitter Magic (Hardcover),Adrienne Tooley
541,"Frostblood (Frostblood Saga, #1)",Elly Blake
542,"Carve the Mark (Carve the Mark, #1)",Veronica Roth
543,The Idiot (Hardcover),Elif Batuman
544,Under the Whispering Door (Hardcover),T.J. Klune
545,Sweet Cruelty (Ruthless Obsession #1),Zoe Blake
546,"To Bleed a Crystal Bloom (Crystal Bloom, #1)",Sarah A. Parker
547,"The Heart Principle (The Kiss Quotient, #3)",Helen Hoang
548,"The Initiation (Filthy Rich Americans, #1)",Nikki Sloane
549,"Ruthless Fae (Zodiac Academy, #2)",Caroline Peckham
550,"Sinner (Priest, #2)",Sierra Simone
551,Radio Silence (Paperback),Alice Oseman
552,"Learn My Lesson (Wicked Villains, #2)",Katee Robert
553,"Sweet Filthy Boy (Wild Seasons, #1)",Christina Lauren
554,"Winter (Evermore Academy, #1)",Audrey Grey
555,"Rush (Breathless, #1)",Maya Banks
556,"Wings of Ebony (Wings of Ebony, #1)",J. Elle
557,The Betrayals (ebook),Bridget Collins
558,"Shielded (Shielded, #1)",KayLynn Flanders
559,"I Wish You All the Best (I Wish You All the Best, #1)",Mason Deaver
560,"Everything, Everything (Hardcover)",Nicola Yoon
561,"The Queen's Assassin (The Queen's Secret, #1)",Melissa de la Cruz
562,"The Bone Witch (The Bone Witch, #1)",Rin Chupeco
563,"Assassin's Apprentice (Farseer Trilogy, #1)",Robin Hobb
564,"Poison Princess (The Arcana Chronicles, #1)",Kresley Cole
565,"The Queen of the Tearling (The Queen of the Tearling, #1)",Erika Johansen
566,"Where Good Girls Go To Die (Good Girls, #1)",Holly Renee
567,"Clockwork Prince (The Infernal Devices, #2)",Cassandra Clare
568,"The Falconer (The Falconer, #1)",Elizabeth May
569,Don't Let Me Fall (Don't Let Me #1),Kelsie Rae
570,"Scream For Us (Holiday Masked Men, #1)",Molly Doyle
571,Wait for It (Kindle Edition),Mariana Zapata
572,To Hate Adam Connor (Kindle Edition),Ella Maise
573,Lightlark (Hardcover),Alex Aster
574,"Barbarian Alien (Ice Planet Barbarians, #2)",Ruby Dixon
575,"Stolen Heir (Brutal Birthright, #2)",Sophie Lark
576,Most of All You (ebook),Mia Sheridan
577,Boy Parts (ebook),Eliza Clark
578,Diary of an Oxygen Thief (Paperback),Anonymous
579,S. (Hardcover),J.J. Abrams
580,"Well Met (Well Met, #1)",Jen DeLuca
581,"Covet (Crave, #3)",Tracy Wolff
582,"A Vow So Bold and Deadly (Cursebreakers, #3)",Brigid Kemmerer
583,Pandora's Jar: Women in the Greek Myths (Hardcover),Natalie Haynes
584,We Are Okay (Hardcover),Nina LaCour
585,Under Locke (Kindle Edition),Mariana Zapata
586,"Dark Lover (Black Dagger Brotherhood, #1)",J.R. Ward
587,"Crownchasers (Crownchasers, #1)",Rebecca Coffindaffer
588,"The Traitor Queen (The Bridge Kingdom, #2)",Danielle L. Jensen
589,"This is War: Travis & Viola, #1 (Checkmate Duet, #1)",Kennedy Fox
590,"The Diviners (The Diviners, #1)",Libba Bray
591,"Skyward (Skyward, #1)",Brandon Sanderson
592,A Lesson in Vengeance (Hardcover),Victoria Lee
593,"Half-Blood (Covenant, #1)",Jennifer L. Armentrout
594,"Shadow Me (Shatter Me, #4.5)",Tahereh Mafi
595,"The Lies of Locke Lamora (Gentleman Bastard, #1)",Scott Lynch
596,"Bared to You (Crossfire, #1)",Sylvia Day
597,"The Crown's Game (The Crown's Game, #1)",Evelyn Skye
598,"Warcross (Warcross, #1)",Marie Lu
599,"Clockwork Princess (The Infernal Devices, #3)",Cassandra Clare
600,Every Summer After (Paperback),Carley Fortune
601,"Dark Fae (Ruthless Boys of the Zodiac, #1)",Caroline Peckham
602,"The Sunderlands (World of Aureum, #1)",Anastasia K. King
603,"The Silent Waters (Elements, #3)",Brittainy C. Cherry
604,A Love Letter to Whiskey (Paperback),Kandi Steiner
605,Monday's Not Coming (ebook),Tiffany D. Jackson
606,"The Beast (Wicked Villains, #4)",Katee Robert
607,"Just Friends (Blue Beech, #6)",Charity Ferrell
608,Crying in H Mart (Hardcover),Michelle Zauner
609,The Last Time We Say Goodbye (Hardcover),Cynthia Hand
610,"Curse of the Wolf King (Entangled with Fae, #1)",Tessonja Odette
611,Trick Mirror: Reflections on Self-Delusion (Hardcover),Jia Tolentino
612,Sweet Black Waves (Sweet Black Waves #1),Kristina Pérez
613,"The Magic of Discovery (Emerald Lakes, #1)",Britt Andrews
614,"A Worthy Opponent (Wicked Villains, #3)",Katee Robert
615,My Lovely Wife (Hardcover),Samantha Downing
616,"Girl, Woman, Other (Hardcover)",Bernardine Evaristo
617,"Beautiful Disaster (Beautiful, #1)",Jamie McGuire
618,"Divergent (Divergent, #1)",Veronica Roth
619,The Nature of Witches (Hardcover),Rachel Griffin
620,Winter's Orbit (Paperback),Everina Maxwell
621,Luster (Hardcover),Raven Leilani
622,Dark Matter (Hardcover),Blake Crouch
623,Pretty Girls (Paperback),Karin Slaughter
624,Blood Heir (Blood Heir Trilogy #1),Amélie Wen Zhao
625,"Wolfsong (Green Creek, #1)",T.J. Klune
626,"An Absolutely Remarkable Thing (The Carls, #1)",Hank Green
627,In a Holidaze (Paperback),Christina Lauren
628,The Woman in the Window (Kindle Edition),A.J. Finn
629,"Her Royal Highness (Royals, #2)",Rachel Hawkins
630,"The Black Witch (The Black Witch Chronicles, #1)",Laurie Forest
631,"The Blade Itself (The First Law, #1)",Joe Abercrombie
632,An Affair of Poisons (Hardcover),Addie Thorley
633,"Cruel Prince (Royal Hearts Academy, #1)",Ashley Jade
634,"A Torch Against the Night (An Ember in the Ashes, #2)",Sabaa Tahir
635,"Captive Prince (Captive Prince, #1)",C.S. Pacat
636,"Crush (Crave, #2)",Tracy Wolff
637,"Where Dreams Descend (Kingdom of Cards, #1)",Janella Angeles
638,"Daughters Of Nri (The Return of the Earth Mother, #1)",Reni K. Amayo
639,RoomHate (Paperback),Penelope Ward
640,"Her Villains (The Shattered Isle, #1)",Jade Presley
641,Meet Me Halfway (Meet Me Halfway Series),Lilian T. James
642,The Words (Kindle Edition),Ashley Jade
643,"Daughter of the Moon Goddess (The Celestial Kingdom Duology, #1)",Sue Lynn Tan
644,"Daughter of the Moon Goddess (The Celestial Kingdom Duology, #1)",Sue Lynn Tan
645,"Paint It All Red (Mindf*ck, #5)",S.T. Abby
646,"The Shadow of the Gods (The Bloodsworn Saga, #1)",John Gwynne
647,The Ritual (Kindle Edition),Shantel Tessier
648,"Stroke of Midnight (Cinderella, #1)",K. Webster
649,"Indigo Ridge (The Edens, #1)",Devney Perry
650,"Only When It's Us (Bergman Brothers, #1)",Chloe Liese
651,"Chained Hands (Keir & Sailor Duet #1; Chained Hearts Duets, #1)",T.L. Smith
652,Ledge (The Glacian Trilogy #1),Stacey McEwan
653,"Wrecked (Dirty Air, #3)",Lauren Asher
654,Things I Wanted To Say (But Never Did),Monica Murphy
655,"Red Thorns (Thorns Duet, #1)",Rina Kent
656,Heart of a Monster (New Reign Mafia Duet #1),Shain Rose
657,"The Predator (Dark Verse, #1)",RuNyx
658,"The Reckoning (Zodiac Academy, #3)",Caroline Peckham
659,"A Veil of Truth and Trickery (The Veiled Realm, #1)",Analeigh Ford
660,Without Merit (Kindle Edition),Colleen Hoover
661,"Song of the Forever Rains (Mousai, #1)",E.J. Mellow
662,"Always Only You (Bergman Brothers, #2)",Chloe Liese
663,Tryst Six Venom (Kindle Edition),Penelope Douglas
664,Diver's Heart (Kindle Edition),K.A. Knight
665,Love Unexpected (Kindle Edition),Q.B. Tyler
666,The Girls I've Been (Hardcover),Tess Sharpe
667,Eileen (Hardcover),Ottessa Moshfegh
668,Shipped (Paperback),Angie Hockman
669,Tweet Cute (Hardcover),Emma Lord
670,"Dead Man Walking (The Fallen Men, #6)",Giana Darling
671,"The Infinity Courts (The Infinity Courts, #1)",Akemi Dawn Bowman
672,In the Dream House (Hardcover),Carmen Maria Machado
673,"The Mask of Mirrors (Rook & Rose, #1)",M.A. Carrick
674,Loveless (Paperback),Alice Oseman
675,Home Before Dark (Hardcover),Riley Sager
676,"The Gentleman's Guide to Vice and Virtue (Montague Siblings, #1)",Mackenzi Lee
677,"Reveal Me (Shatter Me, #5.5)",Tahereh Mafi
678,"Grave Mercy (His Fair Assassin, #1)",Robin LaFevers
679,The Penelopiad (Hardcover),Margaret Atwood
680,"A Reaper at the Gates (An Ember in the Ashes, #3)",Sabaa Tahir
681,Queenie (Hardcover),Candice Carty-Williams
682,"Kingsbane (Empirium, #2)",Claire Legrand
683,"These Witches Don't Burn (These Witches Don't Burn, #1)",Isabel Sterling
684,Speak (Hardcover),Laurie Halse Anderson
685,Fabbricante di lacrime (Kindle Edition),Erin Doom
686,Between Wrath and Mercy (The Divine Between #1),Jess Wisecup
687,The Pawn and The Puppet (The Pawn and The Puppet #1),Brandi Elise Szeker
688,The Summer Proposal (Paperback),Vi Keeland
689,"The Unseelie Prince (Maze of Shadows, #1)",Kathryn Ann Kingsley
690,"The Lawyer (The Dalton Brothers, # 1)",Marni Mann
691,Lotus (Kindle Edition),Jennifer Hartmann
692,"All the Lies (Mindf*ck, #4)",S.T. Abby
693,"Sidetracked (Mindf*ck, #2)",S.T. Abby
694,"Stuck with You (The STEMinist Novellas, #2)",Ali Hazelwood
695,"Little Thieves (Little Thieves, #1)",Margaret Owen
696,"Crow (Boston Underworld, #1)",A. Zavarelli
697,"Ruthless People (Ruthless People, #1)",J.J. McAvoy
698,The Enemy Trap (Kindle Edition),Maren Moore
699,"Morning Glory Milking Farm (Cambric Creek, #1)",C.M. Nascosta
700,Sick Fux (ebook),Tillie Cole
701,"7th Circle (Hades, #1)",Tate James
702,"Shadow Princess (Zodiac Academy, #4)",Caroline Peckham
703,"Delilah Green Doesn't Care (Bright Falls, #1)",Ashley Herring Blake
704,Milk Fed (Hardcover),Melissa Broder
705,"Ricochet (Addicted, #2)",Krista Ritchie
706,"When Sinners Play (Sinners of Hawthorne University, #1)",Eva Ashwood
707,"Redeemed (Dirty Air, #4)",Lauren Asher
708,All This Time (Hardcover),Mikki Daughtry
709,"Black Sunshine (Dark Eyes, #1)",Karina Halle
710,"American Royals (American Royals, #1)",Katharine McGee
711,"Full Tilt (Full Tilt, #1)",Emma Scott
712,A Certain Hunger (Audible Audio),Chelsea G. Summers
713,Hani and Ishu's Guide to Fake Dating (Kindle Edition),Adiba Jaigirdar
714,Sweet Dandelion (Kindle Edition),Micalea Smeltzer
715,Kafka on the Shore (Paperback),Haruki Murakami
716,No Longer Human (Paperback),Osamu Dazai
717,"The Silver Swan (Elite Kings Club, #1)",Amo Jones
718,"Crown of Coral and Pearl (Crown of Coral and Pearl, #1)",Mara Rutherford
719,"The Dating Plan (Marriage Game, #2)",Sara Desai
720,"Hollow Heathens: Book of Blackwell (Tales of Weeping Hollow, #1)",Nicole Fiorina
721,"The Unbroken (Magic of the Lost, #1)",C.L. Clark
722,"Flamecaster (Shattered Realms, #1)",Cinda Williams Chima
723,Just Kids (Hardcover),Patti Smith
724,"Alex, Approximately (Hardcover)",Jenn Bennett
725,"It Ain't Me, Babe (Hades Hangmen, #1)",Tillie Cole
726,"The Ruin of Kings (A Chorus of Dragons, #1)",Jenn Lyons
727,"The Thief (The Queen's Thief, #1)",Megan Whalen Turner
728,"The Lost Sisters (The Folk of the Air, #1.5)",Holly Black
729,"Wintersong (Wintersong, #1)",S. Jae-Jones
730,"Winter (The Lunar Chronicles, #4)",Marissa Meyer
731,"Cress (The Lunar Chronicles, #3)",Marissa Meyer
732,"A Sky Beyond the Storm (An Ember in the Ashes, #4)",Sabaa Tahir
733,Grown (Hardcover),Tiffany D. Jackson
734,You Should See Me in a Crown (Hardcover),Leah Johnson
735,"Boys of Brayshaw High (Brayshaw, #1)",Meagan Brandy
736,"Ruined (Ruined, #1)",Amy Tintera
737,"The Bone Season (The Bone Season, #1)",Samantha Shannon
738,"The Hazel Wood (The Hazel Wood, #1)",Melissa Albert
739,"Vampire Academy (Vampire Academy, #1)",Richelle Mead
740,"Sleet Kitten (Sleet, #1)",S.J. Tilly
741,Darling Venom (Kindle Edition),Parker S. Huntington
742,"Scarlet Angel (Mindf*ck, #3)",S.T. Abby
743,Tempt Me (The Wolf Hotel #1),Nina West
744,"Hunting Adeline (Cat and Mouse Duet, #2)",H.D. Carlton
745,"Fierce King (L.A. Ruthless, #1)",Sadie Kincaid
746,"The Devil (Devil's Playground, #1)",Ashley Jade
747,Luna and the Lie (ebook),Mariana Zapata
748,More Than Once (More Than #1),Dominique Wolf
749,Not Here to Be Liked,Michelle Quach
750,Make It Sweet (Kindle Edition),Kristen Callihan
751,"A Marvellous Light (The Last Binding, #1)",Freya Marske
752,Lessons in Sin (ebook),Pam Godwin
753,"Believe Me (Shatter Me, #6.5)",Tahereh Mafi
754,All the Little Lies (English Prep #1),S.J. Sylvis
755,Sicko (ebook),Amo Jones
756,Four (Kindle Edition),Sara Cate
757,"The Architect (Nashville Neighborhood, #3)",Nikki Sloane
758,"Long Shot (Hoops, #1)",Kennedy Ryan
759,"Cursed Fates (Zodiac Academy, #5)",Caroline Peckham
760,"Captive of the Horde King (Horde Kings of Dakkar, #1)",Zoey Draven
761,"Fire Night (Devil's Night, #4.5)",Penelope Douglas
762,"Empire of the Vampire (Empire of the Vampire, #1)",Jay Kristoff
763,"Founded on Goodbye (Mixtape, #1)",Kat Singleton
764,"Kiss of War (City of Stars, #1)",Clara Elroy
765,"Addicted for Now (Addicted, #3)",Krista Ritchie
766,Whispers and the Roars (Kindle Edition),K. Webster
767,99 Percent Mine (Hardcover),Sally Thorne
768,The Boy with Fire (The Ravence Trilogy #1),Aparna Verma
769,"Pucked (Pucked, #1)",Helena Hunting
770,"Kate (Madison Kate, #4)",Tate James
771,"Fake (Madison Kate, #3)",Tate James
772,"The Third Best Thing (Fulton U, #3)",Maya Hughes
773,"Liar (Madison Kate, #2)",Tate James
774,"Tokyo Ever After (Tokyo Ever After, #1)",Emiko Jean
775,The Wrong Game (Kindle Edition),Kandi Steiner
776,Fool Me Twice (Paperback),Carrie Aarons
777,"Hall of Smoke (Hall of Smoke, #1)",H.M. Long
778,"Again, but Better (Hardcover)",Christine Riccio
779,Four Psychos (The Dark Side #1),Kristy Cunning
780,The Cousins (Library Binding),Karen M. McManus
781,"The Merciful Crow (The Merciful Crow, #1)",Margaret Owen
782,Something to Talk About (Paperback),Meryl Wilsner
783,"Lightbringer (Empirium, #3)",Claire Legrand
784,"Stolen (Stolen, #1)",Lucy Christopher
785,The Binding (Hardcover),Bridget Collins
786,"Hothouse Flower (Calloway Sisters, #2)",Krista Ritchie
787,"The Shadow Queen (Ravenspire, #1)",C.J. Redwine
788,"Dark Harmony (The Bargainer, #3)",Laura Thalassa
789,Emma in the Night (Hardcover),Wendy Walker
790,The Winter Duke (Hardcover),Claire Eliza Bartlett
791,"The Winner's Curse (The Winner's Trilogy, #1)",Marie Rutkoski
792,One Percent of You (Kindle Edition),Michelle Gross
793,Faking with Benefits (Paperback),Lily Gold
794,"Ruining Dahlia (Mafia Wars, #3)",C.R. Jane
795,The American Roommate Experiment (Paperback),Elena Armas
796,"The Witch Collector (Witch Walker, #1)",Charissa Weaks
797,"Heartless Sky (Zodiac Academy, #7)",Caroline Peckham
798,"Under One Roof (The STEMinist Novellas, #1)",Ali Hazelwood
799,"Below Zero (The STEMinist Novellas, #3)",Ali Hazelwood
800,"All the Feels (Spoiler Alert, #2)",Olivia Dade
801,Come anima mai (Kindle Edition),Rossana Soldano
802,After I Do (Paperback),Taylor Jenkins Reid
803,"Savage Lover (Brutal Birthright, #3)",Sophie Lark
804,Untainted (The Crystal Island #1),Lilian T. James
805,Perfect Strangers (Kindle Edition),J.T. Geissinger
806,Ghosted (Paperback),J.M. Darhower
807,"Vicious Kings (The Dark Elite, #1)",Eva Ashwood
808,Morally Corrupt (Kindle Edition),Veronica Lancet
809,"Hero (Marry the Scot, #3)",Jolie Vines
810,Milk and Honey (Paperback),Rupi Kaur
811,"Bloodied Hands (Bellandi Crime Syndicate, #1)",Adelaide Forrest
812,"Mafia Mistress (The Kings of Italy, #1)",Mila Finelli
813,"Wicked Beauty (Dark Olympus, #3)",Katee Robert
814,"Hunter (Hunting Her, #1)",Eden Summers
815,"Filthy (The Five Points' Mob Collection, #1)",Serena Akeroyd
816,"Kingdom of the Feared (Kingdom of the Wicked, #3)",Kerri Maniscalco
817,"Sinners' Playground (The Harlequin Crew, #1)",Caroline Peckham
818,"The Trouble with Hating You (The Trouble with Hating You, #1)",Sajni Patel
819,Conclave (Devil's Night #3.5),Penelope Douglas
820,Jade Fire Gold (Hardcover),June C.L. Tan
821,"Three Simple Rules (Blindfold Club, #1)",Nikki Sloane
822,"The Perfect First (Fulton U, #1)",Maya Hughes
823,"Divine (Divine, #1)",M.J. Woodman
824,"You Had Me at Hola (Primas of Power, #1)",Alexis Daria
825,"Queen Takes Rose (Wicked Villains, #6)",Katee Robert
826,In Deeper Waters (Hardcover),F.T. Lukens
827,"Dead Moons Rising (Honest Scrolls, #1)",Jack Whitney
828,A Man Called Ove (Hardcover),Fredrik Backman
829,"Burn (Dark in You, #1)",Suzanne Wright
830,A Pho Love Story (Hardcover),Loan Le
831,Opposite of Always (Kindle Edition),Justin A. Reynolds
832,"Divine Blood (Guardians of the Maiden, #1)",Beck Michaels
833,If I Had Your Face (Hardcover),Frances Cha
834,"The Maze Runner (The Maze Runner, #1)",James Dashner
835,One Day in December (Paperback),Josie Silver
836,Educated (Hardcover),Tara Westover
837,"Vein Of Love (Blackest Gold, #1)",R. Scarlett
838,"The Knife of Never Letting Go (Chaos Walking, #1)",Patrick Ness
839,"Poison Study (Study, #1)",Maria V. Snyder
840,"Harry Potter and the Sorcerer's Stone (Harry Potter, #1)",J.K. Rowling
841,"The Queen's Rising (The Queen’s Rising, #1)",Rebecca Ross
842,Four Dead Queens (Hardcover),Astrid Scholte
843,"There Will Come a Darkness (The Age of Darkness, #1)",Katy Rose Pool
844,Master of Salt & Bones (Kindle Edition),Keri Lake
845,"A Strange Hymn (The Bargainer, #2)",Laura Thalassa
846,Mr. Wrong Number (Kindle Edition),Lynn Painter
847,Restore me,J.L. Seegars
848,"Ignite (Cloverleigh Farms, #6)",Melanie Harlow
849,I Kissed Shara Wheeler (Hardcover),Casey McQuiston
850,The Longing of Lone Wolves (Fae Guardians #1),Lana Pecherczyk
851,Book of Night (Hardcover),Holly Black
852,"One Moment Please (Wait With Me, #3)",Amy Daws
853,Find Me (WITSEC #1),Ashley N. Rostek
854,"Secrets We Hunt (One Night, #2)",Dana Isaly
855,Into the Dark (Kindle Edition),Dana Isaly
856,Little Devil (Kindle Edition),Bethany Winters
857,"The Spy (Kingmakers, #4)",Sophie Lark
858,"Gilded (Gilded, #1)",Marissa Meyer
859,Moon Touched (Zodiac Wolves #1),Elizabeth Briggs
860,"Broken Vow (Brutal Birthright, #5)",Sophie Lark
861,Don't Kiss the Bride (Kindle Edition),Carian Cole
862,"Daughter of No Worlds (The War of Lost Hearts, #1)",Carissa Broadbent
863,Convenience Store Woman (Paperback),Sayaka Murata
864,"Flame and Starlight (The Esteria, #1)",Dana Isaly
865,"A Lie for a Lie (All In, #1)",Helena Hunting
866,"Fight Dirty (Black Rose Kisses, #1)",Eva Ashwood
867,"A Court of Honey and Ash (Honey and Ice Trilogy, #1)",Shannon Mayer
868,"Resurrection (The Sainthood - Boys of Lowell High, #1)",Siobhan Davis
869,The Summer of Broken Rules (Hardcover),K.L. Walther
870,"A Song Below Water (A Song Below Water, #1)",Bethany C. Morrow
871,"Rejected (Shadow Beast Shifters, #1)",Jaymin Eve
872,Sistersong (Hardcover),Lucy Holland
873,The Great Gatsby (Paperback),F. Scott Fitzgerald
874,"Court (Crave, #4)",Tracy Wolff
875,What My Mother and I Don't Talk About: Fifteen Writers Break the Silence (Hardcover),Michele Filgate
876,"The Wedding Date (The Wedding Date, #1)",(Editor)
877,You Have a Match (Hardcover),Jasmine Guillory
878,Untamed (Hardcover),Emma Lord
879,Two Can Keep a Secret (Hardcover),Glennon Doyle
880,Sweetbitter (Hardcover),Karen M. McManus
881,101 Essays That Will Change the Way You Think (Kindle Edition),Stephanie Danler
882,The Midnight Bargain (Hardcover),Brianna Wiest
883,More Happy Than Not (Hardcover),C.L. Polk
884,"Twist Me (Twist Me, #1)",Adam Silvera
885,No Exit (Kindle Edition),Anna Zaires
886,"The Bone Witch (The Osseous Chronicles, #1)",Taylor Adams
887,"Shadow Frost (Shadow Frost, #1)",Ivy Asher
888,"Witches Steeped in Gold (Witches Steeped in Gold, #1)",Coco Ma
889,"The Way of Shadows (Night Angel, #1)",Ciannon Smart
890,Shameless King (Kings of Rittenhouse #1),Brent Weeks
891,The Loneliest Girl in the Universe (Paperback),Maya Hughes
892,"Wait for You (Wait for You, #1)",Lauren James
893,"The Traitor's Kiss (The Traitor's Circle, #1)",Jennifer L. Armentrout
894,"The Mermaid, the Witch, and the Sea (Hardcover)",Erin Beaty
895,Forbidden (Paperback),Maggie Tokuda-Hall
896,More Than This (Paperback),Tabitha Suzuma
897,Giovanni's Room (Paperback),Patrick Ness
898,"The Girl of Fire and Thorns (Fire and Thorns, #1)",James Baldwin
899,"We Set the Dark on Fire (We Set the Dark on Fire, #1)",Rae Carson
900,"The Friend Zone (The Friend Zone, #1)",Abby Jimenez
901,Among the Beasts & Briars (Hardcover),Ashley Poston
902,We Are the Ants (Hardcover),Shaun David Hutchinson
903,Spinning Silver (Kindle Edition),Naomi Novik
904,"Bound by Hatred (Born in Blood Mafia Chronicles, #3)",Cora Reilly
905,"Angry God (All Saints High, #3)",L.J. Shen
906,"Master of Crows (Master of Crows, #1)",Grace Draven
907,"Lord of the Fading Lands (Tairen Soul, #1)",C.L. Wilson
908,"The Star-Touched Queen (The Star-Touched Queen, #1)",Roshani Chokshi
909,"City of Glass (The Mortal Instruments, #3)",Cassandra Clare
910,"The Lost Hero (The Heroes of Olympus, #1)",Rick Riordan
911,"The Darkest Minds (The Darkest Minds, #1)",Alexandra Bracken
912,"Iron Heart (Crier's War, #2)",Nina Varela
913,Clap When You Land (Hardcover),Elizabeth Acevedo
914,The Perfect Marriage (Paperback),Jeneva Rose
915,It's Kind of a Funny Story (Paperback),Ned Vizzini
916,They Wish They Were Us (Hardcover),Jessica Goodman
917,"Rebel of the Sands (Rebel of the Sands, #1)",Alwyn Hamilton
918,"These Rebel Waves (Stream Raiders, #1)",Sara Raasch
919,"Oaths and Omissions (Monsters & Muses, #3)",Sav R. Miller
920,"Triple Threat (Deception Duet, #1)",K. Webster
921,"Only a Monster (Monsters, #1)",Vanessa Len
922,A Brush with Love (Paperback),Mazey Eddings
923,"Tools of Engagement (Hot & Hammered, #3)",Tessa Bailey
924,Gallant (Hardcover),V.E. Schwab
925,My Name Is Pink (Kindle Edition),Veronica Lancet
926,"Make Me Yours (Bellamy Creek, #2)",Melanie Harlow
927,"Mindf*ck Series (Mindf*ck, #1-5)",S.T. Abby
928,Forget Me Not (Paperback),Melissa Morgan
929,Dear Enemy (Kindle Edition),Kristen Callihan
930,"The Villain (Boston Belles, #2)",L.J. Shen
931,The Reading List (Hardcover),Sara Nisha Adams
932,"Drive Me Wild (Bellamy Creek, #1)",Melanie Harlow
933,A Risk on Forever (Paperback),N.S. Perkins
934,Skin of the Sea (Skin of the Sea #1),Natasha Bowen
935,"Model Behavior (Wrecked Roommates, #1)",Kelsie Rae
936,"Born, Darkly (Darkly, Madly Duet, #1)",Trisha Wolfe
937,Dirty Curve (Kindle Edition),Meagan Brandy
938,Grand Lies (The Promise Duet #1),J.C. Hawke
939,She Gets the Girl (Hardcover),Rachael Lippincott
940,"Nikolai: A Mafia Prince Romance (Russian Mob Chronicles, #1)",Shandi Boyes
941,"Ruthless Empire (Royal Elite, #6)",Rina Kent
